{
  "schemaVersion": "trading_research.state_probe.v1",
  "generatedAt": "2026-01-05T00:00:00Z",
  "probe": {"id": "synthetic-liquidity", "featureId": "turnover_ratio_2d_5d", "shortWindow": 2, "longWindow": 5, "thresholds": {"compressed": 0.85}, "horizons": ["1d", "5d", "20d"], "episodeMinFalseDays": 1},
  "current": {"date": "2026-01-05", "value": 0.82, "percentile": 0.11, "zScore": -1.42, "slope": -0.02, "state": "compressed", "condition": true},
  "events": [
    {"date": "2026-01-03", "value": 0.84, "percentile": 0.14, "zScore": -1.2, "slope": -0.01, "state": "compressed", "condition": true},
    {"date": "2026-01-04", "value": 0.83, "percentile": 0.12, "zScore": -1.3, "slope": -0.01, "state": "compressed", "condition": true},
    {"date": "2026-01-05", "value": 0.82, "percentile": 0.11, "zScore": -1.42, "slope": -0.02, "state": "compressed", "condition": true}
  ],
  "outcomes": [
    {"horizon": "1d", "sampleCount": 3, "eligibleCount": 3, "censoredCount": 0, "coverage": 1, "episodeCount": 1, "winRate": 0.67, "meanReturn": 0.012, "medianReturn": 0.01, "baselineMeanReturn": 0.004, "meanExcessReturn": 0.008, "meanMfe": 0.018, "meanMae": -0.006, "averageCapitalOccupancy": 1.7, "peakCapitalOccupancy": 2},
    {"horizon": "5d", "sampleCount": 3, "eligibleCount": 2, "censoredCount": 1, "coverage": 0.6666666666666666, "episodeCount": 1, "winRate": 0.5, "meanReturn": 0.021, "medianReturn": 0.021, "baselineMeanReturn": 0.01, "meanExcessReturn": 0.011, "meanMfe": 0.04, "meanMae": -0.012, "averageCapitalOccupancy": 2.2, "peakCapitalOccupancy": 3},
    {"horizon": "20d", "sampleCount": 3, "eligibleCount": 0, "censoredCount": 3, "coverage": 0, "episodeCount": 1, "winRate": null, "meanReturn": null, "medianReturn": null, "baselineMeanReturn": null, "meanExcessReturn": null, "meanMfe": null, "meanMae": null, "averageCapitalOccupancy": null, "peakCapitalOccupancy": null}
  ],
  "quality": {"status": "warning", "warnings": ["synthetic fixture: not production research"]},
  "provenance": {"source": "synthetic-fixture", "definitionVersion": "state-probe.v1"}
}
